{
  "schema": "AIFC/historical-semantic-anchor/v1",
  "anchor_id": "AIFC-SEMANTIC-ANCHOR-AUTHORITY-CLOSED-PROOF-V1",
  "source_artifact_id": "AIFC-RELEASE-GATE-v1.0.9-draft",
  "source_commit_sha": "7e58b47398fe585b24db6304ee6122871095d668",
  "source_path": "conformance/AIFC-RELEASE-GATE-v1.0.9-draft.json",
  "source_git_blob_sha1": "e46cfee9963e61a22bc25e4e68ac5f11781e8d47",
  "semantic_loci": [
    {"locator_type":"REQUIRED_CHECK_ID","locator_value":"AUTHORITY_CLOSED_PROOF","located_value_sha256":"a7b52dbb67c796b9b3ee870e9dc643a64ea5ad8958dacf8a5819eba70e926a60"},
    {"locator_type":"FORBIDDEN_SHORTCUT_EXACT","locator_value":"allowing a transition proof to create or select the normative semantics that constitute its own theorem","located_value_sha256":"19b46e2165edb0c8093505fd1937c093d8d29d73a4e551428fb645fd783c3685"},
    {"locator_type":"FORBIDDEN_SHORTCUT_EXACT","locator_value":"allowing a normative root to self-authenticate through a descendant transition","located_value_sha256":"4adcd2c1f896033dd173468cee1e0c686f151994a2f3ca693bcbc5fdc2dc4d93"}
  ],
  "interpretation_origin": "LATER_FORMALIZATION_OF_HISTORICAL_NORMATIVE_TEXT",
  "interpretation_status": "INTERPRETATION_CANDIDATE",
  "retroactive_discovery_of_preexisting_executable_semantics": false,
  "authority_lineage_status": "NOT_ESTABLISHED_SUCCESSOR_CANDIDATE"
}
